معرف المبنى,اسم المبنى,رمز البناء,المدخل الرئيسي,يحتوي على مصعد,درج_موقع,منطقة الانتظار
1,ا,ا,ردهة القبول الجنوبية,1,الدرج الأيسر بالقرب من مدخل الكافيتريا. الدرج المركزي على يسار قسم المالية. الدرج الأيمن بالقرب من مدخل موقف السيارات.,الطابق الأرضي: ردهات القبول والاستقبال والشؤون المالية.
2,ب,ب,ردهة القبول الجنوبية,1,درجتان حلزونيتان مركزيتان في الردهة الرئيسية,
3,ت,ت,ردهة القبول الجنوبية,0,الدرج الأيمن في منتصف الردهة. الدرج الأيسر في نهاية الردهة.,
4,ث,ث,ردهة القبول الجنوبية,0,يوجد درجتان مباشرة أمام كل مدخل.,
5,ج,ج,ردهة القبول الجنوبية,0,الدرج الأيسر بالقرب من المدخل الأمامي. الدرج الأيمن بالقرب من المدخل الخلفي.,حديقة بالدور الارضى